id,name,name_en,title,catg,catg_cn,catg_en,tag,intro1,intro2,intro2_en,coin_consume,coin_consume_vip,freq_all,coll_all,degree,viponly,onlineflag,autoflag,order,onlinetime,img
222,序列LOGO,Seqlogo,seqlogo,seqdeal,序列处理,,,,分析和展示蛋白或核酸序列的保守性,Analyze and display the conservation of motif sequence of protein or nucleic acid,5,0,0,31,000,0,1,1,167,2023-01-06 17:06:15,20221229112056849433.svg
223,包珠图,circlepacker,circlepacker,plot,基础绘图,,,,包珠图（Circular Packing），一种特殊的分类树状图,,7,0,0,33,000,0,1,1,168,2023-02-16 17:03:11,20230208104143245360.svg
224,表格格式转换,transtable,transtable,form,表格与格式,,,,实现“长数据”和“宽数据”之间的快速相互转换，以满足不同绘图工具的格式要求。,"Achieve fast mutual conversion between ""long data"" and ""wide data"" to meet the formatting requirements of different plotting tools.",5,0,0,14,000,0,1,1,169,2023-04-13 11:11:18,20230407165927859885.svg
225,比例韦恩图,Prop Venn,prop_venn,plot,基础绘图,,,,按照数据集实际比例关系绘制韦恩图,Prop_Venn diagram is drawn according to the actual scale relation of data set,8,0,0,80,000,0,1,1,170,2023-04-25 16:39:05,20230423113934655938.svg
226,动态环状热图,circular_heatmap,report_circular_heatmap,report,动态交互,,,,将矩阵表格数据绘制成一个环状热图,Use circular heatmap representation of data matrix with colors.,20,0,0,146,000,0,1,1,171,2023-06-02 11:26:23,20230602093625626290.svg
227,动态网络韦恩图,report_venn_network,report_venn_network,report,动态交互,,,,绘制具有韦恩图特性的网络图,Create a network graph with Venn diagram characteristics,10,0,0,101,000,0,1,1,172,2023-06-15 02:08:00,20230614105119155184.svg
228,动态堆叠连线图,report_stack_line,report_stack_line,report,动态交互,,,,同时展现不同元素在不同分组的占比情况及增减趋势变化,Show the proportion and trend of different elements in different groups,10,0,0,57,000,0,1,1,173,2023-06-21 10:36:12,20230620094055684186.svg
229,TCGA基因查询,TCGA genes explore,tcga,report,动态交互,,,,在TCGA数据库中探索感兴趣的基因,Explore the genes of interest in the TCGA public database,1,0,0,34,000,0,1,0,175,2023-09-28 15:32:19,20230915170123861880.svg
230,动态散点-盒形图,report_scatter_box,report_scatter_box,report,动态交互,,,,边际图的一种，可同步展示变量关系和数据分布情况,Variable relationships and data distribution can be displayed synchronously.,3,0,0,23,000,0,1,1,176,2024-07-18 15:04:55,20240716094253966054.svg
231,报账用结题报告,virtual_report,virtual_report,plot,基础绘图,,,,,,0,0,0,5,000,0,1,1,177,2025-08-28 12:09:09,
232,文献翻译,literature_translation,literature_translation,plot,基础绘图,,,,在pdf中直接进行文本翻译，可获得单语言mono和双语言dual版本的pdf,,25,0,0,13,000,0,1,1,178,2025-10-23 09:35:28,20251016161609209614.png
233,报账用结题报告2,virtual_report2,virtual_report2,plot,基础绘图,,,,,,0,0,0,3,000,0,1,1,179,2025-12-03 14:46:06,
